{
  "_readme": "雛形をコピーしただけで、色とコンポーネントがまだ埋まっていない状態。",
  "version": 1,
  "tokens": {
    "color": {
      "brand-primary": "#1F6FEB",
      "surface": "[要記入]",
      "text-body": "[要記入]"
    },
    "spacing": {
      "sm": "8px",
      "md": "16px",
      "lg": "24px"
    },
    "font": {
      "body": "Noto Sans JP"
    },
    "radius": {
      "card": "12px"
    }
  },
  "components": [
    "Button",
    "[要記入]"
  ],
  "prohibited": [
    {
      "pattern": "[要記入]",
      "why": "[要記入]"
    }
  ]
}
